text,rating,neg,neu,pos,compound,vader_sentiment
"I tried this in a large to extra, extra, extra large and all the sizes in-between and these bras fit me perfectly in any of those sizes without much difference in feel or tightness. I got these to help reduce swelling after surgery and this is working perfectly for me. I also love the lilac color. Unfortunately, this one arrived with very poor side stitching. It looks like someone sewed the sides by hand as can be seen from the photo. Other than this, they are the same as every other one I ordered.<br /><br />Note that they wash well in a lingerie bag but I lay them flat to dry.",3,0.034,0.82,0.146,0.8721,positive
"I tried this in a large to extra, extra, extra large and all the sizes in-between and these bras fit me perfectly in any of those sizes without much difference in feel or tightness. I got these to help reduce swelling after surgery and this is working perfectly for me. I also love the lilac color.  They also wash well in a lingerie bag but I lay them flat to dry.",4,0.0,0.82,0.18,0.8735,positive
"I ordered a 3-pack and am disappointed that this is actually a 1-pack (one bandeau). The one I received is a comfortable,  “barely there” bandeau yet perfect for light post-surgery compression. I would rate the product 4 stars but give it 1.5 stars for advertising the wrong quantity and shortchanging the purchaser out of two bandeaus.<br /><br />I tried this in a large to extra, extra, extra large and all the sizes in-between and these bras fit me perfectly in any of those sizes without much difference in feel or tightness. I got these to help reduce swelling after surgery and this is working perfectly for me. I also love the lilac color. Note that they also wash well in a lingerie bag. I lay them flat to dry but have tumble dried them on low for a few minutes without any issue. If this had come in a three-pack as currently described on the Amazon site when I ordered it, this would have received 4 stars.",2,0.049,0.767,0.184,0.9789,positive
"I tried this in a large to extra, extra, extra large and all the sizes in-between and these bras fit me perfectly in any of those sizes without much difference in feel or tightness. I got these to help reduce swelling after surgery and this is working perfectly for me. I also love the lilac color.<br /><br />Note that they also wash well in a lingerie bag. I lay them flat to dry but have tumble dried them on low for a few minutes without any issue.",4,0.03,0.824,0.146,0.8074,positive
"I tried this in a large to extra, extra, extra large and all the sizes in-between and these bras fit me perfectly in any of those sizes without much difference in feel or tightness. I got these to help reduce swelling after surgery and this is working perfectly for me. I also love the lilac color.<br /><br />Note that they also wash well in a lingerie bag. I lay them flat to dry but have tumble dried them on low for a few minutes without any issue.",4,0.03,0.824,0.146,0.8074,positive
"I tried this in a large to extra, extra, extra large and all the sizes in-between and these bras fit me perfectly in any of those sizes without much difference in feel or tightness. I got these to help reduce swelling after surgery and this is working perfectly for me. I also love the lilac color.<br /><br />Note that they also wash well in a lingerie bag. I lay them flat to dry but have tumble dried them on low for a few minutes without any issue.",4,0.03,0.824,0.146,0.8074,positive
"I tried this in a large to extra, extra, extra large and all the sizes in-between and these bras fit me perfectly in any of those sizes without much difference in feel or tightness. I got these to help reduce swelling after surgery and this is working perfectly for me. I also love the lilac color.",4,0.0,0.725,0.275,0.9571,positive
"I love the color of these compression socks. I ordered the small/medium size even though I should have ordered a large because I take a size 9 to 9.5 shoe. Nevertheless, these fit me perfectly and the large would have been too big. The compression is strong, so I do find these difficult to wear all day.  The only thing I do not like about these socks is that they come up to my lower thighs which requires me to fold them over to get them below my knees.",4,0.072,0.777,0.151,0.8552,positive
"I tried their [[ASIN:B08F7QQ11T colorful version]] of this mask and it was so large it would not stay on my face or ears. However, this one is a little snugger. It does stay on my nose and ears but I have to be careful it does not fall down during use because it is still larger than I need. It is a comfortable and attractively designed gaiter.<br /><br />The current price of $12.99 is expensive but still competitive for this.",3,0.0,0.848,0.152,0.9136,positive
"I think the current price of $9.99 is reasonable for this. The reason I say that is because I attend craft fairs and have often seen bling like this being sold for $15 to $18 as extras for a handmade purse.<br /><br />This can be used as a keychain, jewelry for a purse, or both a keychain and jewelry at the same time. There is a keyring for the keys and also another loop to hook onto the handbag. It is cute and decorates an appropriate bag. It also decorates a keychain if not using this as a handbag bauble.<br /><br />I also love the velvet drawstring bag it came with as I can use this to store a piece of my jewelry since this keychain is in use.",5,0.0,0.922,0.078,0.8658,positive
"There are two delicate necklaces in this set. The circular studded one has a 16"" choker length chain that is adjustable to four lengths. However, I doubt anyone is skinny enough to be able to use all those adjustments. I had to use it on the longest length.  The long bar has a 20"" chain but extends an additional 4.5"" with the extra piece hanging at the end. This chain is adjustable to five lengths.  Both necklaces can be worn at once or separately. The long bar looks great on a solid colored turtleneck. The small necklace looks great just on a bare neck with almost any blouse as it sits right at the throat.<br /><br />I think the current price of $19.99 is competitive for this. Be aware that the chains are thin and are easily knotted. Care has to be taken when storing and wearing. This is definitely a very attractive but delicate adjustable necklace set.",4,0.026,0.779,0.195,0.9836,positive
"These peds are terrible. They are thin and do not stay on my feet. Once I walk with them, they ride under the heel, fall off the back, etc. I hate these.<br /><br />They are soft despite their thinness but it does not matter as I would never order this again. I take a size 9 to 9.5 in a woman's shoe and these size 9-11 no-show socks just do not stay put. I am so sorry I was influenced by the other positive reviews so much so that it caused me to order a pair for me.",1,0.08,0.869,0.051,0.0714,positive
"I ordered several pairs of these socks in different styles. These run a size larger than expected.  I take a size 9 to 9.5 in a woman's shoe and 7.5 to 8 in a man's boot. I ordered these in a small / medium size which is rated for up to size 8 in a woman's size and they fit me almost perfectly. I did try a medium / large pair in another style and they were too loose. Even in this small /medium size, the heel can come up above my heel if I pull on the sock too much; nevertheless, they are almost a perfect fit.<br /><br />They offer medium compression around my calves and some compression on the soles of the feet and archs. I like the ""normal sock"" look of these knee-highs. I like the stripes but what I do not like is the washed out pink color that looks very dingy. They wash well in the washer but I lay them flat to dry.<br /><br />They offer 15 to 20 mmHg Compression and are made of 45% cotton, 40% nylon, and 15% spandex. The current price of $19.95 is expensive for a pair of socks but is competitively priced with typical compression socks. I wish this color were a bit better because then it would have gotten 5 stars.",4,0.008,0.883,0.109,0.9615,positive
"I almost rated this hat 2 stars and if I saw this in a store, I would not have purchased this.<br /><br />The hat itself is very nice and very attractive in the various shades of brown. It has a partially canvass-like and knit exterior with fake leather and fur. The interior head area is quilted and the ear area also has fake fur. This hat is both warm and comfortable.<br /><br />The fur sheds, which is a negative. However, the biggest negative is the buckle. No matter how I tried, I could not fasten the buckle with the hat on. Instead, I had to fasten it before I put it on. Lucky I am still able to work my head into this with the buckle already fastened.  I personally only like clasps on these type hats. Having to rig this up like a belt is awkward and almost impossible to do. Had I not be able to get this on my head with it already fastened, I would have rated this 2 stars. It is only 3 stars because I am still able to use this hat.<br /><br />If this had a clasp like bike helmets have, I would have rated this 4 stars. If the fake fur was non-shedding as well, it would have gotten 5 stars.",3,0.099,0.804,0.097,-0.3213,negative
"I do not care for this scarf. It is very thin and also itchy. The edging is sloppy looking and the angled cut at the end is very unattractive to me. It works well as a scarf but had I seen this in person in a store before ordering, I would never have ordered this.",2,0.131,0.84,0.029,-0.5362,negative
"This blouse is both too large and too small at the same time. Also the cut is unflattering for heavier women. I ordered the 1X size because it is made of stretchy material and sizing is always a guess when ordering online.<br /><br />I take a large to 1X depending on the cut. However, this is designed poorly for those who are shapely. First of all, the shoulder area is huge. It is actually falling off my shoulders. However, the stomach area and where it is gathered in front fits but it is a snug and form fitting fit that makes me look like I am pregnant. It is just horrible.<br /><br />The only thing I like on this blouse is the 3/4 flare sleeves. Other than this, this blouse is not for me and does not fit right nor have a flattering profile due to the form-fitting waist and absolutely huge falling-off-the-shoulders neckline.",2,0.042,0.849,0.109,0.9145,positive
"This is a super attractive top. It is flattering and form fitting and should be worn with a bra, camisole, or other type undergarment. The fabric is thin and moves with my body. I love the peek-a-boo sleeves. It is true to size and the large fits me perfectly. It also makes me look more slender than I am and I am big on top.  The tulip-cut bottom is also extremely complimentary and goes well with leggings. However, I do wish this was about two inches longer on the bottom. It drapes down to my upper thighs and I am 5 feet 5 inches tall.<br /><br />The smell of the fabric is the only thing that prevented me from rating this 5 stars. I am hoping it washes away over time.  It is made in China of 95% Polyester and 5% Spandex and is best washed in a lingerie bag in the washer and then hung dry. Tumble drying this tunic will destroy it.",4,0.031,0.749,0.22,0.9852,positive
"I am personally not crazy about this bag because it is so large. It fits my 12.9"" iPad with its cover with no problem and has room to spare for wallet, phone, keys, etc.<br /><br />The front is buff colored with two strips of dark brown and a buckle in the middle as decoration. The reverse side has a generous zippered pocket that will fit a small writing pad. The interior is a snap closure with one zippered pocket and two slip pockets on the opposite side.<br /><br />There is a regular carry handle and also a longer shoulder strap. What is interesting is that the shorter carry handle is gray to match the gray strip down the middle of the bag. However, the should strap is buff colored to match the rest of the bag.<br /><br />In addition to the above, the bag also comes with a ""Moda labeled"" clear plastic string-backpack-type ""bag"" shown in the last photo.<br /><br />In summary, this bag is not for me as I do not like its large size, shape, and style.  It is made of faux leather and looks and feels cheap to me in person. The cloth interior feels nice, though and the zippers glide easily. On the positive side, since it is made of PU leather, it is easily cleaned and maintained. It is spacious but I was not looking for something so large. It is functional and useful but, after having seen it, is not my style. However, if someone is looking for a large bag that gives the appearance of leather from a distance, then this might fit the bill.",3,0.025,0.889,0.086,0.9306,positive
"This is my first pair of bike shorts so I have nothing to compare it to. However, I was a little surprised at how much padding is in these shorts. It goes from the front to the back and does help soften the seat during a ride. Unfortunately, walking in these is like having something stuck between my legs. I personally hate that but I suppose it is expected with bike shorts. The large is also a little loose on me which is surprising.<br /><br />Overall, this will be my first and last pair of bike shorts simply because I cannot handle the feeling of having a wad of gel padding in the seat area.",3,0.085,0.871,0.044,-0.5736,negative
"This infinity scarf is made in China of 90% polyester and 10% linen. It is a very nice loop scarf and looks good on me. However, it is a bit itchy and it is too warm for the summer.  Otherwise, it is very attractive. I rated this 3 stars due to the itch and the fact that this is labeled a spring/summer scarf when I feel it is more fall/winter.<br /><br />This pairs exceptionally well with this [[ASIN:07PWVVL89 accsa Women's Fedora]].",3,0.025,0.816,0.159,0.8854,positive
"I LOVE HATS. They are an obsession with me. This is a very wide brim summer hat that is great for sun protection. I personally prefer smaller brimmed hats simply because wider brims flop. This rim is no different. It does rest down toward my shoulders; however, I like the protection if offers and it is moderately attractive on.<br /><br />The head circumference is small on this hat. I take a small hat so it fits me perfectly but someone else might have a problem. The bow is a nice touch. The head cap itself is also a bit floppy and the only thing that makes it hold its shape is the shape of ones head in the hat.<br /><br />If the brim were smaller, this would have gotten five stars from me. I am glad for the small head size, so the sizing is perfect for me. The black trim is also decorative and helps glam this up a bit.<br /><br />Attached are two photos of my stuffed giraffe modeling this latest acquisition.",4,0.046,0.804,0.15,0.9658,positive
"I love the variegated color and the soft feel of the faux fur against my ears. I wore them last night and they kept my ears warm in the cold.<br /><br />However, these ear muffs suffer from the same problem as most of my ear muffs . If my hood or coat collar hits into them, they will move around or pop off my head. The only muffs that stay put are the cheap ones whose ear ""buds"" fold in on themselves. Even my expensive UGG muffs have this issue, because like these, there is no flex built in for movement.<br /><br />The faux fur did shed a bit at the beginning but now that has stopped. I believe that is probably due to ""wayward hairs"" left over from the manufacturing process.<br /><br />Overall, I really love these. One other positive is that they do not give me a headache. Some other muffs squeeze my brain so tight, that I get head pain. I do feel the current price of $25.95 is about $6 too much for these, however. The only reason I took off one star is because of both the price and the fact that there is no movement in the ear piece or headband--but then again that is typical of most muffs.<br /><br />- Body is 94% polyester and 6% spandex.<br />- Faux Fur is 84% moda acrylic and 16% polyester<br />- Filling is 100% polyester<br /><br />UPDATE Jan 10, 2019 - I also ordered this in the [[ASIN:B07HKSBNCF gray]], which looks like a variegated brown. It is just as nice as the other ones, except the pair I received is a bit tighter around my head and the end of the muff comes right to the end of my ears. Since these are not adjustable, I would expect some people with big or tall heads to have a problem with these muffs not covering their ears.",4,0.057,0.872,0.071,0.765,positive
"This is a very nice form-fitting, stretchy ribbed sleeveless turtleneck. The collar is single layer so there is no folding it over. This looks great on me under a jacket or another shirt. I do wish the waist was a few inches longer, but overall it is very nice.<br /><br />It washes well in a lingerie bag and I hang dry it.",4,0.028,0.825,0.147,0.748,positive
"I really love the colors on this long-sleeve bathing suit top. It also would have fit me fine except that the pink panel is stitched in such a way that part of this top stretches uncomfortably to the lower side of my armpits. If this were one solid piece, it would have been beautiful and smooth but the stitched panels just do not work for me especially since I am so big up top and do not have an ironing board type chest.",1,0.039,0.795,0.166,0.8018,positive
"I love newsboy caps or what I call dutch painter caps. This one is for winter. It is lined and keeps the top of my head warm.  I would have rated this 5 stars if there were not two disappointing issues.<br /><br />ISSUES<br /><br />- First, the rim is tight. I had to wear this hat about 30 minutes before it loosened up enough to feel comfortable. I always take a size small hat, so I think anyone who has a medium or large head would get a headache at least at the beginning until the band loosened. The tight band is necessary to keep the hat secured, but it did take some getting use to.<br /><br />- Second, the rim is folded over and it takes a lot of effort to have it folded the right way. After 30 minutes, the rim stayed put but then it folded over again during non-use.  The second photo shows the rim folded over the cap lid and the third photo shows it folded correctly. It has to be folded correctly to secure the cap to the head, otherwise there is no elastic to keep it in place.<br /><br />Since I take a size small cap and the rim will eventually stretch and stay put, I love this hat and cannot wait to wear it during the winter (with ear muffs, of course). It is super attractive.<br /><br />MATERIAL and CARE<br />- Shell is faux fur at 72% modacrylic and 28% polyester.<br />- Lining and filling are both 100% polyester.<br />- Dry clean only.",4,0.01,0.881,0.109,0.9757,positive
"I really like the top on this. It fits nice, looks great on, and does not have a padded bra insert. I dislike padded bra inserts, so this is a plus. The bottoms, however, feel gathered even though they look like boy shorts. As a result they feel weird on and they have the feel of riding down in the middle on me. The top is 5 stars and the bottoms are 2 stars.",3,0.054,0.738,0.208,0.9065,positive
"This is a nice faux fur vest with hood. It has a couple of hook clasps in front and two small pockets for the hands. Unfortunately, it was way too small for me. I think I would need a plus size in this vest; it seems more of a misses size. However, it is really nice and I consider the sizing issue my problem.<br /><br />This is dry clean only.",4,0.065,0.818,0.117,0.575,positive
"I love the color and love the look. I also do not mind that it is thin. I feel this could be used by both a man or a woman. I actually ordered this for me.<br /><br />However, this scarf is a bit itchy to me; therefore, I will have to make sure I wear a turtleneck when using this or put it outside my jacket. There is no tag on it but the Amazon site says it is made of 100% acrylic. As you can see from the photo, the edges are also kind of &#34;ratty.&#34; There is currently no price posted, but in its current condition, I would not pay more than $12 for this scarf.<br /><br />I usually wash scarves like this in a lingerie bag and hang dry them.",3,0.045,0.851,0.103,0.768,positive
"This cap feels sturdy. It is similar to a typical baseball cap with a mesh back (for ventilation). The front of the cap is made of a fake leather that can be wiped clean. I LOVE the wide brim because it keeps the sun out of my eyes. The back is easily adjustable with the typical plastic snaps typical to most caps of this style. The color is a baby pink that is perfect for summer.<br /><br />However, I have one absolute HATE. There is a black asterisk embroidered on the back next to the strap along with the words &#34;about last night&#34; above the strap. I am not usually one to wear suggestive messages such as this and for this reason only, it is a two-star hat to me. I wish I had noticed this before I placed my order.  Other than this saying, it is a five-star cap (see front and back pictures attached).",2,0.047,0.85,0.103,0.836,positive
"This is a wide (1-1/2&quot;) high-quality belt. It only has five holes and it is very similar to [[ASIN:B07B9RV2D4 Filgate Genuine Leather Fashion Belt with Single Prong Buckle Black 38&quot;]]. In my boyfriend's and my opinion, it could use a couple more holes, just in case it is needed. Nevertheless, it goes through his pant loops easily. The buckle is also nice and simple. The leather is soft.  Both he and I think this is a beautiful yet very simple belt that can be worn with dress pants or jeans. It is more a casual belt than a dress belt but my boyfriend loves it since he dresses casual. Overall, this is likely to last many years.",5,0.013,0.86,0.126,0.9133,positive
"This is a nice leather case for small eyeglasses. My eyeglasses slide easily into the opening as you can see from the picture.  The interior is not lined, so the leather comes in contact with the lens. However, it is not scratchy so it has no ill effect. Obviously, this is a soft case, so it only protects my glasses from scratches and not from sitting on them or crushing them. However, anyone who purchases a case like this already knows that.",4,0.086,0.8,0.114,0.3612,positive
"This is an attractive suit that I found just a bit tricky to get into. I like the easy closing clasp around the neck. The straps in the back can get a bit tangled when putting this on but straighten out once pulled up to the neckline. This suit does not have any type of control built in, so one's shape shows as is--fully tummy and all. What I do not like is the bra inserts. On the one I received, the right insert kept folding over and it was difficult to straighten out. Personally, I do not like inserts of any kind in a bathing suit or bra. However, if they stayed in place that would be acceptable, but these do not. It is mainly for this reason that an otherwise attractive suit is a disappointment to me.<br /><br />The label recommends hand washing only and line drying. I always machine wash items like this in a lingerie bag and hang dry.",2,0.05,0.765,0.185,0.9734,positive
"This card holder is very small and good enough to hold about 10 business cards comfortably and one ID in front of that or one business card in front.  This is stitched well and genuine leather. Mine arrived with two glue or some other stains on it that I was able to mostly wipe off. The front slot has a hole (not a pull tab) that allows one to push the contents up from the bottom.<br /><br />I do not recommend this as a wallet or to hold bills as it is way too small. I do feel the current price of $23.99 is $6 to $9 too much for this since its carrying capacity is limited. Other than this, it is well made and is perfect for business cards.",3,0.03,0.868,0.102,0.8706,positive
"I first bought a pair of these socks in women's at REI for $27 and loved them. I wanted another color of the same sock so I purchased [[ASIN:B0100LZGCA Darn Tough Merino Wool Mountaineering Extra Cushion Sock - Women's Emerald Medium]]. In addition, I purchased this pair for my boyfriend because I loved them so much.<br /><br />These socks are wonderful. They are slightly thick, sturdy, snug but not too tight, and feel fabulous on. They cushion the heel and bottom of the foot and they do not move around like other socks, which helps prevent blisters.<br /><br />My boyfriend just wrote me about them and he said verbatim &#34;I really love these heavy socks you bought me. I’ve been wearing them to bed every night.&#34;<br /><br />These are quality socks.",5,0.028,0.812,0.16,0.9624,positive
"I first bought a pair of these socks at REI for $27 and loved them. I wanted another color of the same sock so I purchased these. These socks are wonderful. They are slightly thick, sturdy, snug but not too tight, and feel fabulous on. They cushion my heel and bottom of foot and they do not move around like other socks, which helps prevent blisters. I walk a lot and these socks stay put even on a two-hour walk. I LOVE THEM.<br /><br />One caveat, however. These socks must be an older model of the same sock that I purchased at REI. The reason I say that is because compared to the original sock I purchased, they are about two inches shorter. I then did some research and found a comparison chart for two of the same mountaineering socks by the same name. The only difference between the two models is that there's a slightly different fabric combination and it is not listed as quick drying.<br /><br />To me both socks feel the same. I also ordered three more pairs. I now own five pairs of these socks and they are WONDERFUL! In fact, I love them so much that I ordered this [[ASIN:B01F47N7XK men's pair]] for my boyfriend. My boyfriend loves them as well. He wears them to bed.",5,0.011,0.805,0.184,0.9923,positive
