text,rating,neg,neu,pos,compound,vader_sentiment
"This kimono fits well. It has a tie at the front that I thought I wouldn’t like, but it is actually nice. It doesn’t make the kimono tight at all, but it does keep it from falling off. The sleeves are really large on this. The kimono itself is a little on the short side. I am 5’4” and it came right to my hips. I love the colors.",5,0.026,0.798,0.176,0.8979,positive
"These are really fun ear muffs. They are fuzzy and purple. My tween thinks they are awesome. They more sit on top of the ears than cover them, but it isn’t uncomfortable.",5,0.09,0.741,0.169,0.2449,positive
Cute sleeping mask is so soft on the inside. It isn’t too strong of elastic. Perfect.,5,0.0,0.565,0.435,0.875,positive
Very comfortable. The colors are awesome. I dislike the very visible seams. They are even more evident than they’d be with a hand made item.,4,0.08,0.585,0.335,0.8516,positive
"These pants fit really well and they look nice. My real problem with them is just the material. It reminds me of dress pants from the '90s. They have a little bit of shine, and they are loud. Like polyester. They just weren't quite the right look for me. The fit is great. I'm just not digging the fabric- which is purely personal preference.",4,0.036,0.742,0.222,0.92,positive
"This coat is super nice. It is very warm. It has just the right heaviness to it. I don't like a super light jacket, but I also don't want one too weighty. The fur is very soft. It came in a very nice bag, which is helpful for storing it out of season. I'm really happy with this coat. It is luxurious, but wearable on a daily basis.",5,0.037,0.691,0.272,0.9607,positive
"This is a really cute shirt for kids. It is like a thick t-shirt. It isn't quite a sweatshirt. Really, the only complaint I have is that the neck ribbing gets a little wonky after a few washes. It looses it's shape a little bit. So, it looks a little more messy on a daily basis than it really should. My son loves the shirt and it usually barely hits his drawer before he is back in it.",3,0.083,0.797,0.12,0.6013,positive
These are really comfortable pants. I think they are a little on the small side. They aren’t very stretchy. The cut is a bit weird. They look like a cross between leggings and Wind pants. The material is like an old school wind suit.,3,0.085,0.734,0.18,0.6736,positive
This is the absolute perfect tunic! I love it. The fabric is so soft. It is just amazingly perfect!,5,0.0,0.552,0.448,0.9214,positive
"I love this cardigan! It is nice and long. It is a super soft jersey with lots of stretch and bounce. The front was kind of weird for me at first. It isn't intended to close, so the front chest part is pretty narrow compared to other cardigans I own. But it lays so beautifully. I can also push the sleeves up a bit and they stay up. The tie dye is really awesome. It is still mostly white and I do not usually wear white (6 kids, white doesn't ever stay white on me for long) but has enough black and grey that it doesn't feel like white. I am 5'4&#34;. The large completely covers my bum in the back and the front comes down to my knee.<br /><br />** Loved it so much, I got another one in solid black!**",5,0.026,0.778,0.195,0.9813,positive
Pretty cool!,5,0.0,0.0,1.0,0.6996,positive
Earrings were exactly what I wanted.,5,0.0,1.0,0.0,0.0,neutral
Excellent product,5,0.0,0.213,0.787,0.5719,positive
runs big... but good quality,4,0.0,0.51,0.49,0.5927,positive
"Love them, Comfy and great price!",5,0.0,0.318,0.682,0.8622,positive
"I researched these wraps for a long time trying to make sure I found a soft cotton one that was comfy. Unfortunately, I chose this one. It's so big and the Velcro 8s not long enough so I can't wear. The straps are too short to wear comfortably as well. Also, I do not like the feel of microfiber because it feels weird on my skin. It is not a great product in my opinion.",3,0.124,0.782,0.094,-0.3191,negative
"I got one of these as a Amazon Vine reviewer product and unfortunately they seem to have randomized the boxes so I got a Rebecca rather than a Caroline.  I'm guessing that you would receive the right name if you ordered it from Amazon directly.  So I will review it for what the product is.  It is an inexpensive script metal name.  It has a plating of gold and looks OK, although I think it would be appreciated most by girls younger than 12.  I think it looks fairly elegant, but perhaps a bit of a cheesy idea in general.  The chain is ok and it looks ok when worn. I've switched between 3 and 4 stars and it is probably 3.5 in that we mildly like it.",3,0.035,0.825,0.139,0.8811,positive
"These are a wonderfully soft, thin and breathable pair of socks.  I tried them on for working the melting snow on the driveway then going to a movie and it felt great in both places, did not feel cold outside, or make me sweat inside.  I like the idea of odor fighting although I was wearing them in new boots so there hasn't been a test of that.  I actually can't wait to see how they hold up hiking next summer.  For now, they look great, feel great, and I'm glad I got them.",5,0.024,0.766,0.21,0.9648,positive
"I have gotten a number of reviewer products from Awesome 360, mostly socks and Boxer Shorts and I was originally a little worried about what seemed like an off brand.  But they have all proven to be of good quality and they have been wearing and washing well for months now.  I jumped at the chance to review more and I am happy to say that these have lived up to everything I have gotten from them so far.  They are comfortable cotton, good fly.  All in all great boxer shorts.",5,0.013,0.674,0.313,0.9866,positive
"Minnesota is notorious for its mosquitos and I got a reviewer hat in perfect time for trying to find mushrooms.  In fact a week before it arrived, I got chased out of the woods by horse flies, so I was super excited to head back out armed with this hat.  And it did prove to work for the most part.  Aided with long sleeves and long pants I could wade through the swarms and look for mushrooms, but the screen ended up being a hinderance in being able to see mushrooms on the forest floor so I ended up pulling it up a lot.  In the end, the search was still a failure, but a far more comfortable failure.<br /><br />We also took it on a weekend trip to the bourndary waters and it served well enough during the twilight hours.  It is lightweight, reasonably one size fits all and interestingly designed.  I like that the net tucks into the zippered pouch on the top of the head and, while I would not want my high school crush to see me wearing it, it looks ok.  It definitely feels rugged enough to last us for the rest of our mosquito needs.  All in all, we like it, but it is still annoying enough that we can't love it.  Although when you have a huge swarm of mosquitos around your head, you are pretty fond of it.",4,0.067,0.765,0.168,0.9783,positive
"I got this thinking that it would really fit in with my partners hippy side.  Unfortunately, I think it was a little better in the photos than it was on.  It actually looked a lot better on our 11 year old who wore it like a sun dress than it did as an ankle length skirt. I liked the tie died pattern and the color schemed, but it kind of ballooned around her waist and just didn't have a real flattering shape.  The Elastic is tight, but did not seem to finished.",3,0.07,0.832,0.099,0.1804,positive
"These are very casual summer weight pajamas. That is good going into the summer. The material is very thin and designed to be very loose fitting. It is very comfortable, but it has a very unflattering, frumpy look. My partner will probably wear it, but only when lacking other options or very hot weather.",3,0.032,0.866,0.102,0.4582,positive
"These are very decent boxer briefs.  Kid loves that they are tagless, they have good elastic band and nice soft cotton.  He was not quite sure about a waistband that says Awesome 360 but he actually looked forward to wearing them today.  I have a number of pairs myself and I have been very happy with both their style and quality.  They wear and wash well and have everything I'm looking for in a good pair of boxer briefs.  Recommend!",5,0.017,0.704,0.279,0.9724,positive
"These have nearly everything I look for in boxer briefs.  They are tagless, comfortable, nice fitting, and look nice.  The only thing that is missing is a fly hole which is a bit annoying, but forgiveable if everything else is good.  And everything else is good.  I have put two through the wash and they look good and given the quality feel of them, I would expect that they will last well.",5,0.042,0.711,0.247,0.9493,positive
"We got an XL and out of the bag it didn't look anything like an XL.  It did have a surprising amount of stretch, but I still think it is on the small side.  Once on, it did look good and the orange straps on the back look especially nice.  The chest is a little padded and it does provide some good support.  All in all, it's cute and useful, just a little tight for the size.",4,0.017,0.712,0.271,0.9757,positive
"Absolutely gorgeous on my partner. The ivory lace gives a vintage, classy elegance to her outfit.  It is a huge, but wonderfully light scarf that can easily be worn all fall through spring.  I cannot wait until summer is over so I can be at her side while she wears this.<br /><br />The fabric is loose knit and the lace does not contrast with the fabric, more just gives a hint of detail.  It is very subtle and classy.  It should accessorize with almost her entire wardrobe.  Absolutely love the ivory color.",5,0.052,0.703,0.245,0.9686,positive
"This sweatshirt was not very well received.  Our daughter likes baggy sweaters and sweatshirts and the overall fit I think is perfect, but the graphics were not appreciated.  It is wonderfully long which is warm during the eternal Minnesota Winter. The fabric is thick and seems OK, in fact, I think if we could remove the graphic it would be a favorite.<br /><br />Unfortunately the zipper does not seem to be great.  It zips up far better than it zips down and she had to resort to pulling it over her head and it took some wrestling to get it unzipped again.  I wish the nice cut was matched with a nice zipper and graphic.",3,0.054,0.677,0.268,0.9853,positive
When you are pretty in pink you need a pink passport cover.  This one provides rfid and is cute too.,5,0.0,0.733,0.267,0.7351,positive
I actually enjoy these pearls!  The silver chain is delicate and lovely.,5,0.0,0.485,0.515,0.8172,positive
"These sweatpants are made of a light material, yet warm enough in colder weather indoors. Have stood up well to laundering and are economical, too.",4,0.0,0.846,0.154,0.4588,positive
"I am 5' 8'' with a large chest (42 E). The top &#34;fit&#34;, but it wasn't flattering.The back rode up and then the front sunk down. No support whatsoever.<br /><br />I followed my measurements to a T on their size chart. Like I said, it fit, But wasn't a great match if that makes sense.<br /><br />The bottoms fit and covered the cheeks, but the waistband was very tight. It pushed all my skin around my stomach out. So it was a nice tummy suck in, but everything above the waistband got all squished.<br /><br />So I guess maybe if you had less post baby chest and hips, it'd be a better fit haha<br /><br />Loved loved the colors! So bright.<br /><br />I was really hoping this could be a good fit, but it wasn't. Maybe it could be for you. Just keep in mind that the waistband was VERY tight.",2,0.062,0.701,0.238,0.9857,positive
Great product and I always get comments when I wear them.  Slides on the elastic will loosen or tighten for you. Arrived on time,5,0.0,0.837,0.163,0.6249,positive
Bought these as a gift for grandma because we were sick of her wearing her blue blockers that looked too big in her face. These fit her glasses perfectly and now she just has to remember to flip them up and down.,5,0.066,0.741,0.192,0.743,positive
"love the shirt, it looks just like the picture, but the tears are a little scratchy on the skin, I recommend an under shirt when you wear it.",5,0.074,0.689,0.238,0.6428,positive
Synthetic sweaty material. Ill fitting. I can’t say whether this was too large or too small. Technically it fit my waist but the crotch hangs at least 10 inches lower than it should & the top is too baggy but the legs fit as they should. I generally do not have a problem finding clothes that fit online. I was offered a 50% refund if I would keep it but it’s not even worth that. I’m going to pay shipping in order to get the full refund because I can’t even regift this in good conscience.,1,0.08,0.754,0.166,0.8717,positive
Not the best. Too small and broke too easily.,1,0.423,0.412,0.165,-0.5815,negative
The only thing he didn't like was no way to adjust the straps,5,0.141,0.733,0.126,-0.0572,negative
"I purchased this due to being a fan of Game of Thrones.  It is simple, yet beautifully made.  The blue and brown leather really bring the dragon out.  It sets beatifully on the wrist.  I orginal bought this for a friend to have, but now I am thinking of getting something else for them.  This piece really draws the eye and is a  conversation piece.<br /><br />Note : I received this item at a discounted rate for my honest review and opinion.",4,0.0,0.852,0.148,0.8705,positive
Bought this for my Granddaughter to replace one her &#34;Papa&#34; had given her that she had lost.  She said she loves it and wears it everyday.,5,0.077,0.8,0.123,0.34,positive
My dress arrived and it looks nothing like the display picture.  The arms had a thin piece of feathery material on them and hung awkwardly on the shoulders.  The dress was not shaped as shown either.,1,0.118,0.882,0.0,-0.5283,negative
"These are so comfy and warm. Very well made slippers, no missed stitches, or threads hanging out. Soles are solidly fixed on the slippers. Plus I can wear them outside to get the mail. Win,win in my book.",4,0.105,0.787,0.109,0.0404,neutral
"Very nice racer back corduroy tops. Very stretchy and fit well. I machine wash mine in delicate cycle and line dry on a hanger. You get six of them in different colors. My only problem is that they aren't as thick as I hoped, but well worth it. They are long which is nice for when you bend down so there's no embarrassing reveals when your pants slide a little lower than you think.",4,0.128,0.649,0.224,0.6645,positive
It was damaged. The sweater fell apart because it was not sewed together,2,0.195,0.805,0.0,-0.4404,negative
It was a gift,5,0.0,0.408,0.592,0.4404,positive
This is a nice fit and color and it looks nice and washes up nice,5,0.0,0.478,0.522,0.872,positive
A very thin comfortable sock. I was looking for something with cushion.,2,0.0,0.716,0.284,0.5542,positive
3% Wool - Short Winter Crew Socks. Soft comfortable and toasty warm without being hot and sweaty when wearing shores. These were shorter above my ankle then I thought they would be. The color is exactly as shown and they washed great (they didn't leave so much lint in the dryer that they were thinner then before they were washed).,5,0.0,0.838,0.162,0.8572,positive
"Adorable. Looks just like the picture. I don't find it super clunky or too big but I am about 5'8"" so maybe if I was 8 inches shorter I would find it too heavy.",5,0.065,0.814,0.121,0.1967,positive
A little tricky to close. The link chain is sturdy. Comes in a simple refined cardboard box where the bracelet is contained in a plastic sleeve inside a velvet bag.,4,0.05,0.95,0.0,-0.079,negative
Definitely giftable. The colors are true to the picture. The softness of cashmere. Tightly woven.  I will update the review if the pearls fall off my end of the winter season. 180 x 36 inches.,5,0.0,0.849,0.151,0.6705,positive
"measures 42"" in width. Push button Open and Close - that was fun, and startling, to do for the first time, the closing part that is. Resin-reinforced iron and fiberglass ribs. A normal strong wind here on the Oregon Coast is 20mph so it will be fun to test it out the next storm, I haven't used an umbrella much here, rain jackets are the norm where it rains 220 days a year.<br /><br />I would have loved this when I lived in Florida where for 3-4 months year we would have torrential downpours lasting 5-20 minutes and this umbrella would be perfect where 'the pongee inner layer would completely eradicate the soak through or leak, even in torrential downpours'.<br /><br />Another great aspect is on tremedously hot sunny days the 'outer surface is coated with black glue, which can effictivly block UV rays'.",4,0.033,0.806,0.161,0.9657,positive
No Buttons. Requires a camisole to be worn in public. Chiffon is a sheer fabric typically made of silk or nylon. The shirt has a pleat at front and split round collar. Attractive style and fit as expected.,4,0.108,0.76,0.132,0.25,positive
3 pockets on the back of the shirt with a reflective clip. The thin fabric is ideal for keeping cool and cooling off when you stop. Comfortable against my skin. Wash and wear. Fit as expected.  If it falls apart after a dozen washes I will report back.,4,0.042,0.74,0.218,0.8519,positive
"I had to look up what a RUANA was, it's a open front poncho, so there are no sleeves, it drapes across your body. Looks fabulous with a top and casual pants - you really can't go wrong with this color combination, I've worn it with white and black - feels great. You can wear it to work or going out to a restaurant or a party.",5,0.065,0.706,0.23,0.8991,positive
Not very substantial and they stretch a lot.,3,0.232,0.768,0.0,-0.2044,negative
Soft comfortable (nylon/spandex blend) lace and fit; and very attractive. These are exactly as advertised.  Not itchy at all.,5,0.0,0.581,0.419,0.8692,positive
The thick wool hat was a hit - the pull over neck thing was a flop.  I loved the ultra soft neck thing but for style and snug warmth it just doesn't beat the scarf.,4,0.047,0.775,0.178,0.6956,positive
"The color is as vibrant as you see in the picture. Hand Wash, I hung it from a hanger to dry and then put it in the dryer with some stockings/pantyhose to get any wrinkles out. Although for the price, I think I will stick to my favorite [[ASIN:B07CZ3NFM5 Women's 100% Chiffon Scarf Neck Fashionable Printing Country Style Lightweight scarves for Ladies and Girls (Purple)]] and [[ASIN:B015MY2YMA MissShorthair Womens Long Scarf in Solid Color Large Sheer Shawl Wraps for Evening]]",4,0.0,0.865,0.135,0.8807,positive
"Walmart quality, the colors are vibrant. A nice summer weight material not substantial at all, good stitching. Not scratchy but not as soft as I like The size is just as expected.",3,0.036,0.702,0.261,0.7908,positive
"Looks exactly like the picture, this is not a sweatshirt but is a heavy weight t-shirt with a hoodie. I know it says for boys but our 6 year old girl looks awesome in this pullover. Colors are holding up real well after 8 washings. the Cotton-blend fabric is soft and wrinkle free out of the dryer. The only hesitation I would have in ordering is the &#34;Color Stripe may Vary&#34; what exactly does that mean? I think it means the colors won't vary but the strips could be higher or lower depending on the cut of the fabric.",5,0.076,0.788,0.136,0.8126,positive
Comfortable and light. Love them,5,0.0,0.286,0.714,0.8176,positive
Exactly as advertised,5,0.0,1.0,0.0,0.0,neutral
This is a very nice wool cape. I gave it only 4 stars because compared to others I have purchased the material is very thin.,4,0.0,0.866,0.134,0.4754,positive
Nice soft material and color but shows muffin top.,3,0.0,0.631,0.369,0.4767,positive
"Wash well, shrank maybe an inch in dryer but they come long so still cover to wear with leggings. Very stretchy and comfy. Colors are still good after several washes.",5,0.0,0.838,0.162,0.6597,positive
"Went up a size to XL to fit waist of 32. Weight 190, 5ft7. Comfortable. Linen color has a slight yellow cast. Washed cool water, dryer for 15 minutes and hung to finish drying. No shrinkage or wrinkles. Not as soft as rayon pants but should soften with washes.",5,0.032,0.857,0.111,0.4497,positive
Super cute and so comfy.  Love them!,5,0.0,0.255,0.745,0.913,positive
"Warm weather means high humidity in the South. That means poofy hair if you're a curly girl. Scarves are a great way to rescue a bad hair day. You can watch a variety of YouTube videos to help you learn all of the interesting ways to tie them. This set comes in bright and colorful prints. They all work as decorative head scarves. They're quite large, so they're versatile. I'll probably end up buying another set or two. I highly recommend them.<br /><br />Thanks so much for taking the time to read this review.  I hope the information that I've provided helps make your decision a little easier.",5,0.029,0.738,0.233,0.9716,positive
"Jumpsuits are a great way to look put together without much effort. The fabric is soft and very stretchy like a t-shirt. There's a tie at the waist that is purely decorative. If you have a shorter torso, you can fold the fabric at the waist and cover it with a belt. The fit is true to size. For reference, I'm 5'6"", 162lbs and a 34G bra size. The medium fit well.<br /><br />Thanks so much for taking the time to read this review.  I hope the information that I've provided helps make your decision a little easier.",5,0.0,0.783,0.217,0.9669,positive
"I like the colorful print of this dress and the summery style. The problem is that the fabric is very thin and kind of cheap looking. It has just the tiniest hint of stretch. You can pretty much see through it in bright light. The fit runs small. I would have sized up had I read the fabric details. For reference, I'm 5'6"", 162lbs and a 34G bra size. The X-large would have been ideal.<br /><br />Thanks so much for taking the time to read this review.  I hope the information that I've provided helps make your decision a little easier.",4,0.025,0.8,0.176,0.9372,positive
"They had me at Meghan Markle. These sunnies are really cute. They add a touch of class to any outfit. The shape is just shy of a true cat eye. They're very ""Breakfast at Tiffany's"". My only complaint is that they didn't come in a hard case. The pouch is okay, but it doesn't offer much protection. Other than that, I highly recommend this product.<br /><br />Thanks so much for taking the time to read this review.  I hope the information that I've provided helps make your decision a little easier.",5,0.031,0.758,0.211,0.9497,positive
"I wanted to try this dress because of the interesting rounded hem. It's actually nice. It kind of creates a breeze as you're walking. The fabric has a hint of stretch. The dress is unlined, but it's not sheer. There are pockets to add to the overall wearability. The fit is true to size. The smocked top makes this dress flattering on most shapes and sizes.<br /><br />Thanks so much for taking the time to read this review.  I hope the information that I've provided helps make your decision a little easier.",4,0.0,0.735,0.265,0.977,positive
"These pants really nice. Unfortunately, I received two sizes smaller than what I requested. When you read that they're merino wool, you think thick. They're actually super lightweight. You can wear these pants year-round. The waistband has a bit of stretch. The legs have a hint also. Based on how the size 8 fit, I can say that the fit is true to size, but I can't be 100% certain.<br /><br />Thanks so much for taking the time to read this review.  I hope the information that I've provided helps make your decision a little easier.",5,0.018,0.778,0.204,0.9483,positive
"It's sometimes hard to tell what sizes actually mean when you purchase online. I'm happy that these leggings are true to size. The fabric feels like a t-shirt with spandex. It's very soft and comfortable. The waistband is firm and stays in place. There are pockets on the legs to hold your phone or other important items. There's a bit of scrunching in the back to enhance your ""assets"". The fabric is thick enough not to be sheer. The colorful camo is a nice twist. For fit reference, I'm 5'6"" and 162lbs. The large fit well.<br /><br />Thanks so much for taking the time to read this review. I hope the information that I've provided makes your decision a little easier.",4,0.01,0.784,0.206,0.9755,positive
"Leopard print is an instant mood lifter for me. This dress would have been perfect if it had been longer. The fabric is lightweight and stretchy. The scoop neckline is flattering on curves. There is a high waistline that is accented by ruching down the side of the dress. The front hem has a tulip opening. The overall look is very cute, but the hem was just too short for comfort. It hit me around mid thigh. The fit runs a bit small. For fit reference, I'm 5'6"", 162lbs and a 34G bra size. The large would have been ideal.<br /><br />Thanks so much for taking the time to read this review. I hope the information that I've provided makes your decision a little easier.",4,0.0,0.819,0.181,0.9694,positive
"These leggings are very stretchy and comfortable. I like the overall design. The problem is that the leggings run very small. For demonstration purposes, I put this pair on top of another pair that's supposed to be the same size. As you can see, these leggings are much smaller in the waist and thighs. You'll definitely need to size up if you're curvy. I think the X-Large would have been ideal for me. For fit reference, I'm 5'6"" and 153lbs.<br /><br />Thanks so much for taking the time to read this review. I hope the information that I've provided makes your decision a little easier.",4,0.023,0.774,0.202,0.9574,positive
