text,rating,neg,neu,pos,compound,vader_sentiment
"This skirt is really cute! I ordered it for my almost 15 year old daughter. She is 5'7&quot; and weighs about 130 pounds. She wears a junior's medium to large sizing or a women's small to medium. Regarding the fit, it was very comfortable. It's a very flattering cut and style. My daughter absolutely loved the way it made her stomach and hips look. Regarding the length, it is way too short for her. She was hoping she could wear it to school, but she said there was no way she would wear it there. She did say she would wear it during the summer depending on what she was doing. The colors are bright and vibrant. The fabric doesn't wrinkle so that's a plus. As much as we liked the skirt, it was very disappointing to see that there is no hem. The fabric is just cut off at the bottom edge with no sewn (or even non-sewn for that matter) hem. There are no loose threads and it looks straight, but I really can't get past the fact that it is literally just a raw edge.<br /><br />I purchased this at a discounted price in exchange for my honest &amp; unbiased review. My thoughts &amp; opinions are my own.",3,0.103,0.759,0.138,0.8037,positive
"This hashtag #BFF necklace is too cute! My daughter wanted one for an end of the season gift for her Winter Guard Big Sis. They had a personal joke all season about being “BFF”s. It’s always risky ordering jewelry sight unseen, but this turned out to be a pleasant surprise. The hashtag has little crystals on it. The BFF is sturdy and solid. It doesn’t bend or flex when pressure is applied.  The chain is mid-range, but perfect for a teen. It doesn’t look like it’s going to break easily at all.  This is definitely something that my daughter is proud to give as a gift. Overall it’s a nice quality, whimsical piece of jewelry and much nicer than we expected.<br /><br />*I purchased this at a discounted price in exchange for my honest & unbiased review.",5,0.031,0.629,0.34,0.995,positive
"Photos don't do these shoes justice. I was impressed with the quality. I was expecting something discount store quality, but these are brand name quality. The soles are pretty thick. The cat image is nicely detailed. I ordered these for my teenage daughter. She wears about a size 9 wide shoe, but can vary from 8 1/2 to 10 depending on the width. We decided to order the 10 mainly because of the width issue. They are a little large on her, but not to the point that she can't wear them. The width is fine. She finds these to be very comfortable.<br /><br />*I purchased these at a discounted price in exchange for my honest &amp; unbiased review. My thoughts &amp; opinions are my own.",5,0.009,0.837,0.155,0.9595,positive
"I've used eyeglass chains before, but after a while I have given up on them because my glasses would keep falling out. It's not a big deal, but it did get annoying to have to slide the end back onto the frames. The little piece that goes on to the glasses of these looks identical to the ones I've used before, but for some reason I am having much better luck with these.Plus, there is a set of extra end pieces if needed.  After several consecutive days of using it, my glasses have not fallen off once. The chain is a nice stainless steel. I have a plain chain necklace that is very similar to this. The silver color coordinates with my attire easily. I am very impressed with the quality and durability. I usually just wear my glasses on the top of my head when I am not wearing them, but I know that stretches the frames out. Using a chain like this one is better for my glasses.<br /><br />*I purchased this at a discounted price in exchange for my honest & unbiased review. My thoughts & opinions are my own.",5,0.032,0.789,0.179,0.9853,positive
"I was looking for a new swimsuit to wear in our hot tub. I hate wearing the old lady style with skirts because they drip a lot after you get out of the tub and in the winter, that's really uncomfortable! I usually wear a size 18, so I ordered the 5XL. I used the size chart for the item and I took my measurements.  It fits and is wearable, but it's a little too long and gaps a little on the sides below the chest/torso area. I think a size down would have been better. Since I ordered this for use in our hot tub, not to be worn in public,  it will work well enough. There are cup liners/pads, but no support at all in the chest area. A smaller size might have offered a little more support just because it's a little tighter. There are two ties in the back - one around the neck and the other at the lower part of the bra area. The one around the neck was a little annoying because I had to tie it so tightly to support my chest.  The color is really bright. It's more of a neon pink. The construction of the suit is fine. And it arrived much earlier than estimated which is always a plus!<br /><br />*I purchased this at a discounted price in exchange for my honest and unbiased review. My thoughts & opinions are my own.",3,0.057,0.814,0.13,0.9645,positive
"I ordered these for my teenage daughter. She is 5'7&#34; and weighs about 125 pounds. I think these are great! Most of the time I will not let my daughter wear leggings out in public. And if I do let her, I insist that her shirt is long enough to cover her rear. These are the first leggings that we have purchased that don't look inappropriate on her. They are thick enough that you cannot see through the fabric. She usually wears about a size 8 pants. They hug her body well without being too tight or too baggy. The fleece lining is super soft and adds a little extra warmth. She felt that she would not be able to wear them to Winter Guard rehearsals because she would be too warm. The leggings are well constructed. She is very happy  with these.<br /><br />*I purchased these at a discount for the purpose of trying out & reviewing. My thoughts & opinions are my own.",5,0.0,0.858,0.142,0.9726,positive
"My husband wears a watch daily. So far, this one seems to be a nice, good quality time piece. It came beautifully packaged. The watch strap is extremely comfortable to wear. My husband usually prefers watches that don't require buckle fastening, but because this one is so comfortable, he has been wearing it a lot.  It has been keeping accurate time so far. My husband is not always the best at taking care of his watches, so this falls in our price range. It's nice looking enough for him to wear to work or social events. This one is a good value for the price and meets his expectations.<br /><br />*I did receive this for free for the purpose of trying out & reviewing. My thoughts & opinions are my own.",5,0.03,0.753,0.217,0.9803,positive
"I can't read anything without wearing my Readers these days. I make sure that I keep a pair everywhere I might need one. I have ordered many different ones and so far, these are definitely some of the better ones. I often wear a pair on the top of my head so I have them handy. These fit well on my head without slipping down. I've had several different ones that keep slipping off my head when I bend over or tilt my head, these do not. The arms are sturdy and give just enough. The frames feel heavy duty and attractive looking. I am very happy with these! These are definitely better than the ones I pick up at the dollar store.",5,0.0,0.789,0.211,0.9753,positive
Plastic and all squished. No thanks.,1,0.242,0.44,0.319,0.1779,positive
No it was terrible.. poorly made I've seen better rings come out of bubblegum machines.,1,0.122,0.718,0.16,0.1779,positive
the magnetic snap tore out of the fake leather tab after a few months.,2,0.205,0.795,0.0,-0.4767,negative
Loose and comfortable for hanging around the house,4,0.198,0.517,0.284,0.25,positive
My husband loves how it fits.,5,0.0,0.575,0.425,0.5719,positive
"I wear flip flops all the time during the summer outside, and much of the year inside my house (separate pairs to keep the floors cleaner), and am always looking for a good buy.  These are good for the price and, unlike one review I read, spot-on for size (I went with a larger size due to that review and was sorry I did).",4,0.057,0.853,0.09,0.4767,positive
"Works great but you need to keep the ""stickers"" to be able to wear them again",3,0.0,0.855,0.145,0.3716,positive
Love them to death#,5,0.0,0.417,0.583,0.6369,positive
Love the colors. Fits great and very comfortable.,4,0.0,0.296,0.704,0.9168,positive
I like these vest  extenders using them I get so air moving through my leather vest. Can get hot in the summer wearing black leather,5,0.0,0.898,0.102,0.3612,positive
Perfect for keeping road dirt off your face.,5,0.198,0.496,0.306,0.3182,positive
"soft and warm, thank you.",5,0.0,0.405,0.595,0.5267,positive
Stiff linen material. How can there be stretch stretch? Its linen!Not true to fit. Short in length and tiny waist for Xtra large size ordered. I have a 34inch waist. What else could go wrong?,1,0.079,0.768,0.152,0.4314,positive
Nice looking but too small unless you have tiny fingers and for a bonus turned my fingers black after wearing them. Obviously not pure copper,1,0.0,0.768,0.232,0.7684,positive
Good quality for the price. Comfy and looks great.,5,0.0,0.5,0.5,0.7906,positive
"Great dress! Fits well , comfortable, and looks great.",5,0.0,0.224,0.776,0.9312,positive
"Overall I like this bouffant. The fabric is thick and it is well made; it fits well. I purchased it when I was working in the COVID unit. I have long hair and throughout the day it would fall apart and feels heavy, pulling and irritating my scalp. I am sure all the girls with long hair know what I am talking about. This bouffant has enough space to fit all of my hair inside without a hair tie. Being able to avoid touching my hair in a 12-16hr shift is a big plus. However, I am rating it 3 stars... because the color faded dramatically after just 1 wash, 1 drying cycle. It's soooo faded now...<br /><br />I recommend this product, just avoid dark color, so the fading is not too obviouse.",3,0.056,0.838,0.106,0.6808,positive
"Cheap quality, very small, and it took a month to ship, smells like dead fish.",1,0.229,0.638,0.133,-0.4215,negative
Nice. Haven't worn but once. Weather here been in the 80's. Comfy.,3,0.0,0.749,0.251,0.3278,positive
So beautiful. Got lots of complements.,5,0.0,0.544,0.456,0.6361,positive
"Socks are easy to put on and fit up to just below my know.  The only issue i have is that for me, it can get a bit sore at the top  of the sock.  likely with folks with a smaller leg than mine, will fit fine and feel fine.  I have to say that these do over all fit me better then any other sock i have bought.  the size i used is M/L",5,0.031,0.739,0.23,0.9217,positive
these were a big hit at Christmas .. and great for the cold.,5,0.0,0.728,0.272,0.6249,positive
very cute.. somewhat light weight... will make a great chrastmas gift,4,0.0,0.533,0.467,0.7906,positive
Fell apart after a couple washes.,3,0.0,1.0,0.0,0.0,neutral
"Cute! But, a smidge short so it’s awkward. It doesn’t quite cover my booty. My booty is big tho. I still wear it with cute leggings, but it would look better over those leggings a smidge longer.",4,0.055,0.707,0.239,0.8327,positive
"Fit true to size. Came with a small hole on the seam, that’s why 4 stars. Otherwise cute!",4,0.0,0.602,0.398,0.8221,positive
I like it and get lots of<br />Compliments when I wear it.,5,0.0,0.783,0.217,0.3612,positive
"Fits like a glove, I ordered it for Wizard World. I’m still shedding the baby weight so a perfect cosplay was Peter B Parker from Into the spider-verse. I ordered a medium and at first looked like a small but I tried it on a loved it.",5,0.0,0.744,0.256,0.8938,positive
Great belt! Perfect way to dress up an outfit.,5,0.0,0.464,0.536,0.8439,positive
Belt fits well and is a fun accessory to pair with an outfit.,5,0.0,0.649,0.351,0.6597,positive
"This is a lovely nightgown, very soft, not heavy but heavy enough to be warm. Highly recommended.",5,0.0,0.638,0.362,0.7498,positive
"Soft, comfortable, easy to wash, sized well, highly recommended!",5,0.0,0.319,0.681,0.8653,positive
I loved this tee so much but when it arrived the fit and the cut was really unflattering. Cut more like a man's tee than a woman's so I had to return. Shame as the design on the front was fun and was overall a good quality item. Just hated how it looked on.,3,0.214,0.545,0.241,0.2551,positive
Product was as expected and delivery was quick,5,0.0,1.0,0.0,0.0,neutral
Just as expected,5,0.0,1.0,0.0,0.0,neutral
Larger than I expected. Nice for a little thought. On the flimsy side,2,0.0,0.781,0.219,0.4215,positive
Bought this shirt for my brother and he loves it. Said it was the softest shirt he has.,5,0.0,0.821,0.179,0.5719,positive
To big doesn't sit right at all paw is never even visible,1,0.0,1.0,0.0,0.0,neutral
These are perfect. Very easy to put in and very smooth once they are in. I forget they’re even there,5,0.077,0.645,0.278,0.7178,positive
This pair fit very awkwardly. Someone was in a hurry to finish sewing. It feels as though the front and back pieces were reversed in the sewing process.,3,0.086,0.831,0.083,-0.024,neutral
I bought these as a Christmas gift for a fellow Outlander fan. She loved them!,5,0.0,0.489,0.511,0.8553,positive
"I haven't worn outside yet, so I don't know about the waterproof factor.<br />I usually wear a medium in men's gloves.  I ordered medium and they're snug. If I order again I'll go up a size. I will edit post to let you all know about them being waterproof.",4,0.0,0.956,0.044,0.2235,positive
"Cute, but they turn a bit on the foot. I would buy again.",4,0.0,0.833,0.167,0.25,positive
"I love these tops....I've now ordered 3. They are sheer which makes it more comfortable to wear in layers. For the money spent, it is a great purchase. Will probably get a couple more colors.",5,0.0,0.709,0.291,0.9168,positive
"Description is wrong so I'm returning them, no arch support",1,0.353,0.467,0.18,-0.3818,negative
I love the fit.,5,0.0,0.13,0.87,0.7717,positive
"I gave 5 stars for warmth assuming it stands for coolness. Overall, great mask. My husband loves it and uses it for work every day. The elastic keeps it in place and it’s loose enough that he doesn’t feel suffocated while working in a manufacturing plant.",5,0.044,0.749,0.207,0.8591,positive
This is a really cute tote. My 11 yr old was super excited to use this as a way to hold her beads for bracelet making and take them to school. I actually wanted it for myself because it’s really cute and durable and holds a nice amount of stuff. Perfect beach bag or even a purse.,5,0.0,0.704,0.296,0.9606,positive
This is a nice basic sweatshirt. It looks nice on. Doesn’t look like the most expensive but decent. Looks just like the product image.,4,0.0,0.683,0.317,0.7783,positive
This fits well but maybe if I sized down it would be tighter and I wouldn’t need a bra underneath. Could use the extra padding though. I like the color and material though and it appears well made.,4,0.0,0.806,0.194,0.7543,positive
These are cute and look nice on. May not last forever but they fit true to size and are a fun shoe to have.,5,0.0,0.541,0.459,0.936,positive
"I love the cut and fit of this. The material is comfortable but a little lacking in appearance. It’s not bad but could be a little nicer, just looks slightly cheap but that will not keep me from wearing it as I love everything else about it.",4,0.027,0.631,0.342,0.958,positive
Great looking sunglasses that aren’t too dark. I’m not a big fan of lenses that are too dark. They fit a bit snug but not tight.,5,0.055,0.784,0.161,0.4251,positive
This is a great set of grabbers. This is the first set I’ve owned that you can easily fold up. They work great and help me to pick up stuff round the house without having to bend over. They are plastic but they seem to be quality made. Overall I’m very pleased with these.,5,0.0,0.788,0.212,0.8988,positive
"I got the small and the fit is a bit small, I would order a size up. I got the white and it is a bit see through but the material is very light weight and great for hot weather. A great polo for golf or casual wear.",4,0.0,0.708,0.292,0.9455,positive
This is a cute dress. It fits true to size. Will be fun to wear during the summer or with a Jean jacket.,4,0.0,0.664,0.336,0.8442,positive
"These are about 2 sizes too big for my 10yr old. The looked like a kids xl instead of 7-8. Not sure if I received the wrong size, but she was bummed they were too big. They are cute but the material is also a bit thin and see through. Black might be best option of you can find a size that fits.",3,0.052,0.778,0.17,0.8756,positive
"Great belt but I’ve read a lot of places to always order a size up from your waist size, unfortunately for this best I’d recommend going with the waist size you currently are as it seems a bit big. Other than that it still work for me just on the last loop. Overall great quality and broken in, not stiff.",5,0.096,0.675,0.228,0.9001,positive
The look and got is good but the fabric is stiff and not very soft or stretchable. Hoping it will soften up with a few washes but definitely a stiffer fabric. Tight around the arms which is great and not too slim in the mid section.,3,0.0,0.729,0.271,0.9418,positive
This look decent but are much longer and darker (kaki) than what the picture shows. The material  is a bit stiff but hoping it will soften after a few washes. They are somewhat loose fitting. Overall a 3.5-4 star rating for these shorts.,4,0.057,0.86,0.084,0.2936,positive
The fabric is great and you can barely tell you’re wearing them. The worst design ever for your testys and shlong. Looks awkward as anything I’ve ever seen and feels horrible. Seriously someone without a shlong designed these thinking it was a good idea. What a disaster.,2,0.254,0.627,0.119,-0.7906,negative
First off these are very comfortable. I didn’t notice in the description of these that they were more of a capri. They are an ok length but I prefer a bit longer. I am usually a small or medium and got a medium just to make sure they weren’t too tight and they seemed a bit loose at the top and I had to pull them up every now and then. I like the waist height and material.,4,0.038,0.803,0.159,0.8098,positive
Great quality set. Perfect for working out or lounging. Love the color and thickness of the material. I normally wear a small or medium and the medium fit perfectly. Love the tie waist and ribbed texture.,5,0.0,0.55,0.45,0.9747,positive
The lenses are nice to look through but it’s like having a windshield. I’ve used for running and they are just too big for my face. Other than them being big they look nice. Probably perfect for folks with larger faces.,3,0.0,0.721,0.279,0.9313,positive
Nice shorts to workout in or to use as sleep wear. I wear with compression shorts for jogging. Overall very please with the quality of these shorts.,5,0.0,0.817,0.183,0.659,positive
Very pretty top that I got for my 6yr old to wear for holiday pictures. She loves it and it looks so pretty on her. The color is very pretty and it appears to be great quality. Fits true to size. She normally wears 5t and the 4-5t fit great.,5,0.0,0.546,0.454,0.9855,positive
Cute flip flops that look just like product image. Sizing seems to be accurate.,5,0.127,0.582,0.291,0.4767,positive
$72 for these? I don’t think so. The material on these remind me of dress pants I had to wear when I was like 7 years old from TJ Max. And these are considered sport wear? I have UA and Sketchers golf shorts that are made with polyester and spandex which is much more comfortable. These are 98% cotton 2% elastin elastin an feel too thick. Not a fan of how easily they wrinkle. They do look decent to wear but I will not be golfing in these. If you do like wearing heavier material shorts these may work well for you. For me golf shorts and really all shorts should have more flexibility.,3,0.013,0.855,0.133,0.9196,positive
"My 5yr old cheetah print obsessed daughter loves these. They fit true to size, are comfortable and look really cute on. Great quality and would recommend.",5,0.04,0.427,0.533,0.9672,positive
These are thinner than I expected but perfect for pajamas or around the house. I wore the top out of the house with some leggings to go for a walk in and it looked nice. The material is very soft and comfortable. I was hoping I could wear the shorts out of the house too but they would be a bit see through. Fit true to size.,4,0.0,0.671,0.329,0.9807,positive
This pajamas exceeded my expectations. They are great quality and feel like something you would get at Nordstrom’s. The material isn’t thin and cheap and it is very soft and comfortable. It fits true to size. Would make a great gift.,5,0.0,0.63,0.37,0.9636,positive
My 5 yr old was so excited to put these on. They fit perfect and true to size and look so cute on her. They appear well made and don’t look cheap or flimsy. She says they are comfortable to wear.,5,0.0,0.607,0.393,0.9656,positive
I have several other crop tanks like this and I felt like this one didn’t fit as great as others. The fabric gaps a bit at the armpit area and doesn’t sit flush with skin. It also seems a bit small. It is supportive though and probably fine to wear underneath a sweatshirt or to sleep in.,3,0.0,0.747,0.253,0.9274,positive
"I was pleasantly surprised by this shirt! It is so soft, Comfortable and flattering. Sometimes these random amazon brands are hit or miss. This is definitely a hit! The color is so pretty and fits true to size. I unbuttoned 3 buttons but you can button them all or do however many you like. I normally wear a small and the small fit perfectly. If you like a more oversized look I would size up. I also love the length of this top. It has the perfect length, not a crop and not long. Would highly recommend.",5,0.011,0.585,0.404,0.9927,positive
"Nice basic high waisted swim bottom with a good amount of bum coverage. I like the cut, quality and color. Perfect to mix and match with a nice black swim top. Comfortable and appears well made.",5,0.044,0.5,0.456,0.9571,positive
Cute variety of bracelets. Easy to put on and tighten. I cut the ends off some and made new knots so they didn’t have such long ends. Fun for kids and adults.,4,0.055,0.705,0.24,0.7964,positive
Nice bathing suit. It is comfortable and flattering. Order a size up. Has a unique top strap. Modest and supportive.,4,0.0,0.512,0.488,0.886,positive
Nice shorts. Lightweight and breathable. Zippered pockets help keep keys and phone secure. Comfortable and look nice as well. Fit as expected.,5,0.0,0.446,0.554,0.9485,positive
"Cute earrings that my daughters (5,9) both really like. Look well made and are nice and shiny and look just like product image.",5,0.0,0.567,0.433,0.9144,positive
"These looked baggy when I first opened the package but when I tried them on they actually fit really well. I'm used to longer shorts but it's really not in fashion any more., kinda like how cargo pants died a long time ago. You know who you are, get rid of the cargo pants bro. :)",5,0.074,0.727,0.199,0.8047,positive
Cute earrings that are comfortable to wear and lots of variety of styles. Something for kids and adults. Seem well made and look nice as well.,4,0.0,0.612,0.388,0.9062,positive
These shorts are ok for me. I was hoping the material would be a bit softer and the sizing would be a bit looser. I normally wear a small but felt the small were a little to form fitting so a size up would prob be better. Other than that they are a nice basic pair of shorts that appear well made.,3,0.0,0.781,0.219,0.9136,positive
Excellent quality sports bra/top. Feels and looks very high quality. It is extremely comfortable and the stretch makes it fit great. I am usually either a small or medium in a sports bra and 34c in a regular bra and the medium fit great with enough support. I think a small would have worked too. I like that there is removable cups that offer just the right amount of padding.,5,0.0,0.682,0.318,0.9769,positive
"Cute print, the material feels thin but feels durable and keeps you cool while exercising. I normally wear a small or medium and the small was a bit snug, so a medium prob would have been best. If you are between sizes, size up. Love the high waist and phone pocket.",5,0.0,0.722,0.278,0.9555,positive
"Great sports bra. Cute print, comfortable fit, true to size, comfortable material, good padding. I’m a 34c and the medium fit perfectly.",5,0.0,0.296,0.704,0.981,positive
"Nice basic tee. I wish the sleeves were a bit longer. It’s soft and has a bit of stretch. I normally wear a small or medium and felt the medium fit perfectly, the small would have been too snug. Great for lounging or for everyday wear.",4,0.0,0.688,0.312,0.946,positive
Very cute girls chambray dress. Soft material that is very comfortable. Cute buttons on the back. Fits comfortably would say it’s about a size small.,5,0.0,0.607,0.393,0.918,positive
Fit is much different than in the picture and size is smaller than expected. Maybe if I sized up they would fit more like in the picture. But they were too tight in the waist and had an odd fit near the pockets. The material is interesting and seems like a fake linen material that feels cool to the touch.,3,0.095,0.654,0.251,0.8669,positive
Very cute sleeveless dress. I love the look and feel of the material but after wearing it for a full day it has a few pulled threads and the material easily snags. I will still wear it a lot though since it’s so comfortable and versatile. It can be dressed down or up. Fit true to size.,4,0.0,0.69,0.31,0.9668,positive
Nice basic long sleeve tee. 11yr old boy likes it. Material is nice and similar to old navy quality. Fits true to size.,4,0.0,0.629,0.371,0.8807,positive
